{
  "$schema": "https://json-schema.org/draft/2020-12/schema",
  "$id": "https://sethmay.github.io/open-scout-api/schema/v1/requirement-set.schema.json",
  "title": "Requirement set (canonical document file)",
  "description": "One file per published requirement revision: data/requirement-sets/<slug>.json (slug convention: '<subject-slug>-<effective-year>'). Requirement sets are IMMUTABLE dated documents, not versioned entities: a revision is a NEW document whose 'supersedes' points at the previous one. 'subject' targets a merit badge today; ranks and awards reuse this schema unchanged. COPYRIGHT: requirement 'text' is Scouting America's. When verbatim text is present, set includes_official_text=true AND a 'text_rights' statement (enforced below) — the text is reproduced with attribution for non-commercial use and is NOT covered by this dataset's CC BY-NC-SA license. 'summary' (original paraphrase) is an optional supplement. See NOTICE.md.",
  "type": "object",
  "properties": {
    "$schema": { "type": "string", "format": "uri" },
    "id": { "$ref": "common.schema.json#/$defs/Slug" },
    "kind": { "const": "requirement-set" },
    "subject": {
      "$ref": "common.schema.json#/$defs/EntityRef",
      "description": "The badge/rank/award these requirements belong to, e.g. 'merit-badge:first-aid'."
    },
    "effective_from": {
      "$ref": "common.schema.json#/$defs/HistoricalDate",
      "description": "When this revision took effect (transition/grandfathering rules go in 'notes')."
    },
    "effective_to": {
      "anyOf": [
        { "$ref": "common.schema.json#/$defs/HistoricalDate" },
        { "type": "null" }
      ],
      "description": "The date the next edition took effect; null = still in force. Windows are HALF-OPEN: an edition applied when effective_from <= D < effective_to, so this is the successor's effective_from and NOT the last day this edition applied. Consecutive editions of a subject abut exactly - no gap, no overlap."
    },
    "supersedes": {
      "anyOf": [
        {
          "type": "string",
          "pattern": "^requirement-set:[a-z0-9]([a-z0-9-]*[a-z0-9])?$"
        },
        { "type": "null" }
      ],
      "default": null,
      "description": "The immediately previous revision; null = earliest known (not necessarily first ever)."
    },
    "source_document": {
      "type": "object",
      "properties": {
        "title": {
          "type": "string",
          "minLength": 1,
          "description": "e.g. 'Scouts BSA Requirements 2023 (33216)'."
        },
        "url": {
          "type": "string",
          "format": "uri"
        },
        "year": {
          "type": ["integer", "null"],
          "minimum": 1910,
          "default": null
        }
      },
      "required": ["title"],
      "additionalProperties": false,
      "description": "The publication this revision was transcribed from."
    },
    "includes_official_text": {
      "type": "boolean",
      "description": "True iff any requirement node carries verbatim 'text'. Lets a publish step strip or withhold official text wholesale. The flag <-> text-presence correspondence is a PIPELINE-ENFORCED invariant (see TODO.md 'Pipeline validator'); never trust the boolean alone."
    },
    "text_rights": {
      "type": ["string", "null"],
      "default": null,
      "description": "Rights statement for any verbatim requirement `text` in this set. REQUIRED when includes_official_text is true: requirement text is Scouting America's copyright, reproduced with attribution for non-commercial use and NOT covered by this dataset's CC BY-NC-SA license. See NOTICE.md."
    },
    "completion_rule": {
      "type": ["string", "null"],
      "default": null,
      "description": "The source's own statement of how many of `requirements` must be completed, verbatim, when it is not simply 'all of them' — e.g. 'Complete Requirements 1-4 plus at least one other'. null means every listed requirement is required. This is deliberately PROSE, not structure: the pre-2024 Cub adventures state the rule 44 different ways ('Complete Requirement 1 or 2 plus at least two others', 'Requirements 5-7 are optional'), and mechanically converting those into `choose` trees would risk publishing requirements the source never demanded. Publishing the list without the rule would be worse still — a consumer would read six requirements as six obligations. Any requirement number the rule mentions is pipeline-checked to exist."
    },
    "requirements": {
      "type": "array",
      "items": { "$ref": "#/$defs/Requirement" },
      "minItems": 1
    },
    "provenance": { "$ref": "common.schema.json#/$defs/Provenance" },
    "notes": {
      "type": ["string", "null"],
      "default": null
    }
  },
  "required": [
    "id",
    "kind",
    "subject",
    "effective_from",
    "effective_to",
    "source_document",
    "includes_official_text",
    "requirements",
    "provenance"
  ],
  "additionalProperties": false,
  "if": { "properties": { "includes_official_text": { "const": true } }, "required": ["includes_official_text"] },
  "then": { "properties": { "text_rights": { "type": "string", "minLength": 1 } }, "required": ["text_rights"] },
  "$defs": {
    "Requirement": {
      "title": "Requirement",
      "description": "One node of the requirement tree. At least one of text/summary/children must be present. 'choose' = complete N of the children (null = all children required). Option groups (e.g. 'do 7a OR 7b') are a parent node with choose=1. A node that stands for another entity — a Cub rank's adventures, and in future a rank's named merit badges — carries `ref` so consumers resolve it instead of matching on name.",
      "type": "object",
      "properties": {
        "number": {
          "type": "string",
          "minLength": 1,
          "description": "Official label as printed: '1', '2a', '7b(1)'."
        },
        "text": {
          "type": ["string", "null"],
          "default": null,
          "description": "Verbatim official requirement text (© Scouting America). Presence requires includes_official_text=true + text_rights (see NOTICE.md)."
        },
        "summary": {
          "type": ["string", "null"],
          "default": null,
          "description": "Optional original-prose paraphrase/gloss. Not a substitute for the official text; carries no third-party copyright."
        },
        "choose": {
          "type": ["integer", "null"],
          "minimum": 1,
          "default": null,
          "description": "Complete this many of 'children'; null = all. Meaningful only with children (pipeline rule)."
        },
        "ref": {
          "$ref": "common.schema.json#/$defs/EntityRef",
          "description": "The entity this node stands for (e.g. 'adventure:paws-on-the-path'). Present when the requirement is 'complete that entity' and its own requirements live in the entity's requirement-set rather than inline here. `text` still carries the name as printed, so the document reads standalone. Referential integrity is a pipeline rule."
        },
        "children": {
          "type": "array",
          "items": { "$ref": "#/$defs/Requirement" },
          "default": []
        },
        "tenure_months": {
          "type": "integer",
          "minimum": 1,
          "description": "How many months of activity or service this requirement demands, as a MINIMUM. The source phrases it three ways ('for six months', 'for at least six months', 'for a period of at least six months'); serving longer never fails a requirement, so all three are recorded as the same minimum. Derived from this node's own text."
        },
        "badge_count": {
          "type": "object",
          "description": "How many merit badges this rank requires. Present only on the requirement that states them.",
          "properties": {
            "earn": { "type": "integer", "minimum": 1, "description": "Badges earned at this rank." },
            "cumulative": { "type": "integer", "minimum": 1, "description": "Running total across all ranks once this one is complete." },
            "from_eagle_required": { "type": "integer", "minimum": 1, "description": "How many of 'earn' must appear on the Eagle-required list. This is LIST MEMBERSHIP, not slots: every badge on the list is interchangeable here, so Swimming and Hiking count as two. Absent on Eagle itself, whose rule is the stricter 14-slot tree in 'children' - never a bare count." }
          },
          "required": ["earn", "cumulative"],
          "additionalProperties": false
        }
      },
      "required": ["number"],
      "additionalProperties": false,
      "anyOf": [
        { "properties": { "text": { "type": "string" } }, "required": ["text"] },
        { "properties": { "summary": { "type": "string" } }, "required": ["summary"] },
        { "properties": { "children": { "type": "array", "minItems": 1 } }, "required": ["children"] }
      ]
    }
  }
}
