{
  "$schema": "https://sethmay.github.io/open-scout-api/schema/v1/requirement-set.schema.json",
  "id": "lifesaving-2026",
  "kind": "requirement-set",
  "subject": "merit-badge:lifesaving",
  "effective_from": "2026-01-01",
  "effective_to": null,
  "supersedes": "requirement-set:lifesaving-2021",
  "source_document": {
    "title": "Lifesaving Merit Badge Requirements (2026)",
    "url": "https://www.scouting.org/merit-badges/lifesaving/",
    "year": 2026
  },
  "includes_official_text": true,
  "text_rights": "Requirement text © Scouting America, reproduced with attribution for non-commercial Scouting use; NOT licensed under this dataset's CC BY-NC-SA. See NOTICE.md.",
  "requirements": [
    {
      "number": "1",
      "text": "Before doing requirements 3 through 15, review with your counselor the principles of Safe Swim Defense."
    },
    {
      "number": "2",
      "text": "Before doing requirements 3 through 15:",
      "children": [
        {
          "number": "2a",
          "text": "Earn the Swimming merit badge."
        },
        {
          "number": "2b",
          "text": "Swim continuously for 400 yards using each of the following strokes in a strong manner, in good form with rhythmic breathing, for at least 50 continuous yards: front crawl, sidestroke, breaststroke, and elementary backstroke."
        }
      ]
    },
    {
      "number": "3",
      "text": "Explain the following:",
      "children": [
        {
          "number": "3a",
          "text": "Common drowning situations and how to avoid them, such as unfenced residential pools, drop offs, river currents, rip currents, and medical emergencies."
        },
        {
          "number": "3b",
          "text": "How to identify persons in the water who need assistance."
        },
        {
          "number": "3c",
          "text": "The order of methods in water rescue."
        },
        {
          "number": "3d",
          "text": "How rescue techniques vary depending on the setting and the condition of the person needing assistance."
        },
        {
          "number": "3e",
          "text": "Situations for which in-water rescues should not be undertaken."
        }
      ]
    },
    {
      "number": "4",
      "text": "Demonstrate \"reaching\" rescues using various items such as arm, leg, towels, shirts, paddles, poles."
    },
    {
      "number": "5",
      "text": "Demonstrate \"throwing\" rescues using various items such as a line, ring buoy, rescue bag, and free-floating support. Successfully place at least one such aid within reach of a practice victim 25 feet from shore."
    },
    {
      "number": "6",
      "text": "With your counselor's approval, view in-person or on video a rowing rescue performed using a rowboat, canoe, kayak, or stand up paddleboard. Discuss with your counselor how effectively and efficiently the rescue was performed."
    },
    {
      "number": "7",
      "text": "List various items that can be used as aids in a \"go\" rescue. Explain why buoyant aids are preferred."
    },
    {
      "number": "8",
      "text": "Correctly demonstrate rescues of a conscious practice subject 30 feet from shore in deep water using two types of buoyant aids provided by your counselor. Use a proper entry and a strong approach stroke. Speak to the subject to determine his or her condition and to provide instructions and encouragement.",
      "children": [
        {
          "number": "8a",
          "text": "Present one aid to a subject, release it, and swim at a safe distance as the subject moves to safety."
        },
        {
          "number": "8b",
          "text": "In a separate rescue, present the other aid to a subject and use it to tow the subject to safety."
        }
      ]
    },
    {
      "number": "9",
      "text": "Discuss with your counselor when it is appropriate to remove heavy clothing before attempting a swimming rescue. Remove street clothes in 20 seconds or less, enter the water, and approach a conscious practice subject 30 feet from shore in deep water. Speak to the subject and use a nonbuoyant aid, such as a shirt or towel, to tow the subject to safety."
    },
    {
      "number": "10",
      "text": "Discuss with your counselor the importance of avoiding contact with an active subject and demonstrate lead-and-wait techniques."
    },
    {
      "number": "11",
      "text": "Perform the following nonequipment rescues for a conscious practice subject 30 feet from shore. Begin in the water from a position near the subject. Speak to the subject to determine his or her condition and to provide instructions and encouragement.",
      "children": [
        {
          "number": "11a",
          "text": "Perform an armpit tow for a calm, responsive, tired swimmer resting with a back float."
        },
        {
          "number": "11b",
          "text": "Perform a cross-chest carry for an exhausted, responsive subject treading water."
        }
      ]
    },
    {
      "number": "12",
      "text": "In deep water, show how to escape from a victim's grasp on your wrist. Repeat for front and rear holds about the head and shoulders."
    },
    {
      "number": "13",
      "text": "Perform the following rescues for an unconscious practice subject at or near the surface 30 feet from shore. Use a proper entry and strong approach stroke. Speak to the subject and splash water on the subject to determine his or her condition before making contact. Quickly remove the victim from the water, with assistance if needed, and position for CPR.",
      "children": [
        {
          "number": "13a",
          "text": "Perform an equipment assist using a buoyant aid."
        },
        {
          "number": "13b",
          "text": "Perform a front approach and wrist tow."
        },
        {
          "number": "13c",
          "text": "Perform a rear approach and armpit tow."
        }
      ]
    },
    {
      "number": "14",
      "text": "Discuss with your counselor how to respond if a victim submerges before being reached by a rescuer, and do the following:",
      "children": [
        {
          "number": "14a",
          "text": "Recover a 10-pound weight in 8 to 10 feet of water using a feetfirst surface dive."
        },
        {
          "number": "14b",
          "text": "Repeat using a headfirst surface dive."
        }
      ]
    },
    {
      "number": "15",
      "text": "Demonstrate management of a spinal injury to your counselor:",
      "children": [
        {
          "number": "15a",
          "text": "Discuss the causes, signs, and symptoms of a spinal injury."
        },
        {
          "number": "15b",
          "text": "Support a faceup subject in calm water of standing depth."
        },
        {
          "number": "15c",
          "text": "Turn a subject from a facedown to a faceup position in water of standing depth while maintaining support."
        }
      ]
    },
    {
      "number": "16",
      "text": "Demonstrate knowledge of resuscitation procedure:",
      "children": [
        {
          "number": "16a",
          "text": "Describe how to recognize the need for rescue breathing and CPR."
        },
        {
          "number": "16b",
          "text": "Demonstrate CPR knowledge and skills, including rescue breathing, on a mannequin under the guidance of a current CPR/AED instructor trained by a nationally certified provider."
        }
      ]
    },
    {
      "number": "17",
      "text": "With your counselor, discuss causes, prevention, and treatment of other injuries or illnesses that could occur while swimming or boating, including hypothermia, dehydration, heat-related illnesses, muscle cramps, sunburn, stings, and hyperventilation."
    }
  ],
  "provenance": {
    "sources": [
      {
        "url": "https://www.scouting.org/merit-badges/lifesaving/"
      },
      {
        "url": "https://filestore.scouting.org/filestore/Merit_Badge_ReqandRes/Pamphlets/Lifesaving.pdf"
      },
      {
        "citation": "OpenScouting/workbooks badges/lifesaving/2026.md"
      }
    ],
    "method": "curated",
    "verified_at": "2026-07-21",
    "confidence": 0.9,
    "notes": "Requirement text verbatim from the official pamphlet; structure/numbering derived."
  },
  "notes": null
}
