{
  "$schema": "https://sethmay.github.io/open-scout-api/schema/v1/requirement-set.schema.json",
  "id": "adventure-make-it-move-2018",
  "kind": "requirement-set",
  "subject": "adventure:make-it-move",
  "effective_from": "2018-09-01",
  "effective_to": "2022-06-01",
  "supersedes": null,
  "source_document": {
    "title": "Make It Move — Cub Scout Adventure requirements (pre-2024 program, USSSP archive)",
    "url": "http://usscouts.org/advance/cubscout/old/bear-elective-2018.asp",
    "year": 2018
  },
  "includes_official_text": true,
  "text_rights": "Requirement text © Scouting America, reproduced with attribution for non-commercial Scouting use; NOT licensed under this dataset's CC BY-NC-SA. See NOTICE.md.",
  "completion_rule": null,
  "requirements": [
    {
      "number": "1",
      "text": "Create an “exploding” craft stick reaction."
    },
    {
      "number": "2",
      "text": "Make two simple pulleys, and use them to move objects."
    },
    {
      "number": "3",
      "text": "Make a lever by creating a seesaw using a spool and a wooden paint stirrer. Explore the way it balances by placing different objects on each end."
    },
    {
      "number": "4",
      "text": "Complete one of the following:",
      "children": [
        {
          "number": "4a",
          "text": "Draw a Rube Goldberg–type machine. Include at least six steps to complete your action."
        },
        {
          "number": "4b",
          "text": "Construct a real Rube Goldberg–type machine to complete a task assigned by your den leader. Use at least two simple machines and include at least four steps."
        }
      ]
    }
  ],
  "provenance": {
    "sources": [
      {
        "url": "http://usscouts.org/advance/cubscout/old/bear-elective-2018.asp",
        "accessed": "2026-07-27"
      }
    ],
    "method": "scraped",
    "verified_at": "2026-07-27",
    "confidence": 0.8,
    "notes": "Requirement text verbatim from the USSSP archive of the pre-2024 program."
  },
  "notes": null
}
