{
  "$schema": "https://sethmay.github.io/open-scout-api/schema/v1/requirement-set.schema.json",
  "id": "pottery-2009",
  "kind": "requirement-set",
  "subject": "merit-badge:pottery",
  "effective_from": "2009-01-01",
  "effective_to": "2024-12-31",
  "supersedes": "requirement-set:pottery-2003",
  "source_document": {
    "title": "Pottery Merit Badge Requirements (2009, usscouts.org mirror)",
    "url": "http://usscouts.org/mb/mb087.asp",
    "year": 2009
  },
  "includes_official_text": true,
  "text_rights": "Requirement text © Scouting America, reproduced with attribution for non-commercial Scouting use; NOT licensed under this dataset's CC BY-NC-SA. See NOTICE.md.",
  "requirements": [
    {
      "number": "1",
      "text": "Explain to your counselor the precautions that must be followed for the safe use and operation of a potter’s tools, equipment, and other materials."
    },
    {
      "number": "2",
      "text": "Do the following:",
      "children": [
        {
          "number": "2a",
          "text": "Explain the properties and ingredients of a good clay body for the following:",
          "children": [
            {
              "number": "2a(1)",
              "text": "Making sculpture"
            },
            {
              "number": "2a(2)",
              "text": "Throwing on the wheel"
            }
          ]
        },
        {
          "number": "2b",
          "text": "Tell how three different kinds of potter's wheels work."
        }
      ]
    },
    {
      "number": "3",
      "text": "Make two drawings of pottery forms, each on an 8 1/2 by 11 inch sheet of paper. One must be a historical pottery style. The other must be of your own design."
    },
    {
      "number": "4",
      "text": "Explain the meaning of the following pottery terms: bat, wedging, throwing, leather hard, bone dry, greenware, bisque, terra-cotta, grog, slip, score, earthenware, stoneware, porcelain, pyrometric cone, and glaze."
    },
    {
      "number": "5",
      "text": "Do the following. Each piece is to be painted, glazed, or otherwise decorated by you:",
      "children": [
        {
          "number": "5a",
          "text": "Make a slab pot, a coil pot, and a pinch pot."
        },
        {
          "number": "5b",
          "text": "Make a human or animal figurine or decorative sculpture."
        },
        {
          "number": "5c",
          "text": "Throw a functional form on a potter's wheel."
        },
        {
          "number": "5d",
          "text": "Help to fire a kiln."
        }
      ]
    },
    {
      "number": "6",
      "text": "Explain the scope of the ceramic industry in the United States. Tell some things made other than craft pottery."
    },
    {
      "number": "7",
      "text": "With your parent's parent or guardian's permission and your counselor's approval, do ONE of the following:",
      "children": [
        {
          "number": "7a",
          "text": "Visit the kiln yard at a local college or other craft school. Learn how the different kinds of kilns work, including low-fire electric, gas or propane high-fire, wood or salt/soda, and raku."
        },
        {
          "number": "7b",
          "text": "Visit a museum, art exhibit, art gallery, artists' co-op, or artist's studio that features pottery. After your visit, share with your counselor what you have learned."
        },
        {
          "number": "7c",
          "text": "Using resources from the library, magazines, the Internet (with your parent's parent or guardian's permission), and other outlets, learn about the historical and cultural importance of pottery. Share what you discover with your counselor."
        }
      ],
      "choose": 1
    },
    {
      "number": "8",
      "text": "Find out about career opportunities in pottery. Pick one and find out about the education, training, and experience required for this profession. Discuss this with your counselor, and explain why this profession might interest you."
    }
  ],
  "notes": "Historical edition recovered from the usscouts.org mirror, which keeps the preceding edition of each badge alongside the current one. Effective date is the date the source page states; the end date is the day before the next edition we hold began.",
  "provenance": {
    "sources": [
      {
        "url": "http://usscouts.org/mb/mb087.asp",
        "accessed": "2026-07-27"
      }
    ],
    "method": "scraped",
    "verified_at": "2026-07-27",
    "confidence": 0.8
  }
}
