{
  "$schema": "https://sethmay.github.io/open-scout-api/schema/v1/requirement-set.schema.json",
  "id": "gardening-2013",
  "kind": "requirement-set",
  "subject": "merit-badge:gardening",
  "effective_from": "2013-01-01",
  "effective_to": "2017-12-31",
  "supersedes": null,
  "source_document": {
    "title": "Gardening Merit Badge Requirements (2013, usscouts.org mirror)",
    "url": "http://usscouts.org/mb/Old/mb055-13.asp",
    "year": 2013
  },
  "includes_official_text": true,
  "text_rights": "Requirement text © Scouting America, reproduced with attribution for non-commercial Scouting use; NOT licensed under this dataset's CC BY-NC-SA. See NOTICE.md.",
  "requirements": [
    {
      "number": "1",
      "text": "Do the following:",
      "children": [
        {
          "number": "1a",
          "text": "Explain to your counselor the most likely hazards associated with gardening and what you should do to anticipate, help prevent, mitigate, and respond to these hazards."
        },
        {
          "number": "1b",
          "text": "Discuss the prevention of and treatment for health concerns that could occur while gardening, including cuts, scratches, puncture wounds, insect bites, anaphylactic shock, heat reactions, and reactions from exposure to pesticides and fertilizers."
        }
      ]
    },
    {
      "number": "2",
      "text": "Do the following:",
      "children": [
        {
          "number": "2a",
          "text": "Grow six vegetables, three from seeds and three from seedlings, through harvesting."
        },
        {
          "number": "2b",
          "text": "Grow six flowers, three from seeds and three from seedlings, through flowering."
        }
      ]
    },
    {
      "number": "3",
      "text": "Give the nutritional value of the following:",
      "children": [
        {
          "number": "3a",
          "text": "Three root or tuber crops."
        },
        {
          "number": "3b",
          "text": "Three vegetables that bear above the ground."
        },
        {
          "number": "3c",
          "text": "Three fruits."
        }
      ]
    },
    {
      "number": "4",
      "text": "Test 100 garden seeds for germination. Determine the percentage of seeds that germinate. Explain why you think some did not germinate."
    },
    {
      "number": "5",
      "text": "Visit your county extension agent’s office, local university agricultural college, nursery, or a botanical garden or arboretum. Report on what you learned."
    },
    {
      "number": "6",
      "text": "Explain to your counselor how and why honeybees are used in pollinating food crops and the problems that face the bee population today. Discuss what the impact to humanity would be if there were no pollinators."
    },
    {
      "number": "7",
      "text": "Identify five garden pests (insects, diseased plants). Recommend two solutions for each pest. At least one of the two solutions must be an organic method."
    },
    {
      "number": "8",
      "text": "Do ONE of the following:",
      "children": [
        {
          "number": "8a",
          "text": "Build a compost bin and maintain it for 90 days."
        },
        {
          "number": "8b",
          "text": "Build a vermipost bin (worm compost bin) and maintain it for 90 days."
        },
        {
          "number": "8c",
          "text": "Build a hydroponic garden containing three vegetables or herbs, or three ornamental plants. Maintain this garden through harvest or flowering, or for 90 days."
        },
        {
          "number": "8d",
          "text": "Build one water garden, either in a container (at least 12 by 6 inches and 6 inches deep), or in the ground as a small, decorative pond no larger than 6 by 3 feet and 24 inches deep. Maintain the water garden for 90 days."
        },
        {
          "number": "8e",
          "text": "Prepare a honey super for use on a hive or colony. Remove a filled honey super from the hive or colony and prepare the honey for sale."
        }
      ],
      "choose": 1
    }
  ],
  "notes": "Historical edition recovered from the usscouts.org mirror, which keeps the preceding edition of each badge alongside the current one. Effective date is the date the source page states; the end date is the day before the next edition we hold began.",
  "provenance": {
    "sources": [
      {
        "url": "http://usscouts.org/mb/Old/mb055-13.asp",
        "accessed": "2026-07-27"
      }
    ],
    "method": "scraped",
    "verified_at": "2026-07-27",
    "confidence": 0.8
  }
}
