{
  "$schema": "https://sethmay.github.io/open-scout-api/schema/v1/requirement-set.schema.json",
  "id": "adventure-baloo-the-builder-2024",
  "kind": "requirement-set",
  "subject": "adventure:baloo-the-builder",
  "effective_from": "2024",
  "effective_to": null,
  "supersedes": "requirement-set:adventure-baloo-the-builder-2018",
  "source_document": {
    "title": "Baloo the Builder — Scouting America (Cub Scout Adventures)",
    "url": "https://www.scouting.org/cub-scout-adventures/baloo-the-builder/",
    "year": 2024
  },
  "includes_official_text": true,
  "text_rights": "Requirement text © Scouting America, reproduced with attribution for non-commercial Scouting use; NOT licensed under this dataset's CC BY-NC-SA. See NOTICE.md.",
  "requirements": [
    {
      "number": "1",
      "text": "Learn about some basic tools and the proper use of each tool. Learn about and understand the need for safety when you work with tools."
    },
    {
      "number": "2",
      "text": "Practice using four of the tools you learned about in requirement 1."
    },
    {
      "number": "3",
      "text": "Choose a project to build."
    },
    {
      "number": "4",
      "text": "Determine the tools and materials needed to build your project in requirement 3."
    },
    {
      "number": "5",
      "text": "Build your project."
    }
  ],
  "provenance": {
    "sources": [
      {
        "url": "https://www.scouting.org/cub-scout-adventures/baloo-the-builder/",
        "accessed": "2026-07-27"
      }
    ],
    "method": "scraped",
    "verified_at": "2026-07-27",
    "confidence": 0.9,
    "notes": "Requirement text verbatim from the adventure's official page."
  },
  "notes": null
}
