{
  "$schema": "https://sethmay.github.io/open-scout-api/schema/v1/requirement-set.schema.json",
  "id": "adventure-build-it-up-knock-it-down-2018",
  "kind": "requirement-set",
  "subject": "adventure:build-it-up-knock-it-down",
  "effective_from": "2018-09-01",
  "effective_to": "2024",
  "supersedes": null,
  "source_document": {
    "title": "Build it Up, Knock it Down — Cub Scout Adventure requirements (pre-2024 program, USSSP archive)",
    "url": "http://usscouts.org/advance/cubscout/lion-elective.asp",
    "year": 2018
  },
  "includes_official_text": true,
  "text_rights": "Requirement text © Scouting America, reproduced with attribution for non-commercial Scouting use; NOT licensed under this dataset's CC BY-NC-SA. See NOTICE.md.",
  "completion_rule": null,
  "requirements": [
    {
      "number": "1",
      "text": "Discuss with other Lions things that can be built and things that can be knocked down."
    },
    {
      "number": "2",
      "text": "Discuss with other Lions how they and their fellow Lions can be built up and knocked down, not just physically but also emotionally."
    },
    {
      "number": "3",
      "text": "Build structures using available materials."
    }
  ],
  "provenance": {
    "sources": [
      {
        "url": "http://usscouts.org/advance/cubscout/lion-elective.asp",
        "accessed": "2026-07-27"
      }
    ],
    "method": "scraped",
    "verified_at": "2026-07-27",
    "confidence": 0.8,
    "notes": "Requirement text verbatim from the USSSP archive of the pre-2024 program."
  },
  "notes": null
}
