{
  "$schema": "https://sethmay.github.io/open-scout-api/schema/v1/requirement-set.schema.json",
  "id": "adventure-aquanaut-2024",
  "kind": "requirement-set",
  "subject": "adventure:aquanaut",
  "effective_from": "2024",
  "effective_to": null,
  "supersedes": null,
  "source_document": {
    "title": "Aquanaut — Scouting America (Cub Scout Adventures)",
    "url": "https://www.scouting.org/cub-scout-adventures/aquanaut/",
    "year": 2024
  },
  "includes_official_text": true,
  "text_rights": "Requirement text © Scouting America, reproduced with attribution for non-commercial Scouting use; NOT licensed under this dataset's CC BY-NC-SA. See NOTICE.md.",
  "requirements": [
    {
      "number": "1",
      "text": "State the safety precautions you need to take before doing any swimming activity."
    },
    {
      "number": "2",
      "text": "Explain the meaning of “order of rescue” and demonstrate the reach and throw rescue techniques from land."
    },
    {
      "number": "3",
      "text": "Learn how to prevent and treat hypothermia."
    },
    {
      "number": "4",
      "text": "Attempt to tread water."
    },
    {
      "number": "5",
      "text": "Attempt Scouting America swimmer test."
    },
    {
      "number": "6",
      "text": "Have 30 minutes, or more, of free swim time where you practice the Buddy System and stay within your ability group. The qualified adult supervision should conduct at least three buddy checks per half hour swimming."
    }
  ],
  "provenance": {
    "sources": [
      {
        "url": "https://www.scouting.org/cub-scout-adventures/aquanaut/",
        "accessed": "2026-07-27"
      }
    ],
    "method": "scraped",
    "verified_at": "2026-07-27",
    "confidence": 0.9,
    "notes": "Requirement text verbatim from the adventure's official page."
  },
  "notes": null
}
