{
  "$schema": "https://sethmay.github.io/open-scout-api/schema/v1/requirement-set.schema.json",
  "id": "adventure-tiger-circles-2024",
  "kind": "requirement-set",
  "subject": "adventure:tiger-circles",
  "effective_from": "2024",
  "effective_to": null,
  "supersedes": null,
  "source_document": {
    "title": "Tiger Circles — Scouting America (Cub Scout Adventures)",
    "url": "https://www.scouting.org/cub-scout-adventures/tiger-circles/",
    "year": 2024
  },
  "includes_official_text": true,
  "text_rights": "Requirement text © Scouting America, reproduced with attribution for non-commercial Scouting use; NOT licensed under this dataset's CC BY-NC-SA. See NOTICE.md.",
  "requirements": [
    {
      "number": "1",
      "text": "With your parent or legal guardian talk about your family’s faith traditions. Identify three holidays or celebrations that are part of your family’s faith traditions. Draw a picture of your favorite family’s faith tradition holiday or celebration."
    },
    {
      "number": "2",
      "text": "With your family, attend a religious service OR other gathering that shows how your family expresses Family & Reverence."
    },
    {
      "number": "3",
      "text": "Carry out an act of kindness."
    }
  ],
  "provenance": {
    "sources": [
      {
        "url": "https://www.scouting.org/cub-scout-adventures/tiger-circles/",
        "accessed": "2026-07-27"
      }
    ],
    "method": "scraped",
    "verified_at": "2026-07-27",
    "confidence": 0.9,
    "notes": "Requirement text verbatim from the adventure's official page."
  },
  "notes": null
}
