{
  "$schema": "https://sethmay.github.io/open-scout-api/schema/v1/requirement-set.schema.json",
  "id": "adventure-champions-for-nature-bear-2024",
  "kind": "requirement-set",
  "subject": "adventure:champions-for-nature-bear",
  "effective_from": "2024",
  "effective_to": null,
  "supersedes": null,
  "source_document": {
    "title": "Champions for Nature Bear — Scouting America (Cub Scout Adventures)",
    "url": "https://www.scouting.org/cub-scout-adventures/champions-for-nature-bear/",
    "year": 2024
  },
  "includes_official_text": true,
  "text_rights": "Requirement text © Scouting America, reproduced with attribution for non-commercial Scouting use; NOT licensed under this dataset's CC BY-NC-SA. See NOTICE.md.",
  "requirements": [
    {
      "number": "1",
      "text": "Discover natural resources."
    },
    {
      "number": "2",
      "text": "Discover what happens to the wastewater in your community."
    },
    {
      "number": "3",
      "text": "Investigate soil."
    },
    {
      "number": "4",
      "text": "Investigate air pollution."
    },
    {
      "number": "5",
      "text": "Participate in a conservation project."
    }
  ],
  "provenance": {
    "sources": [
      {
        "url": "https://www.scouting.org/cub-scout-adventures/champions-for-nature-bear/",
        "accessed": "2026-07-27"
      }
    ],
    "method": "scraped",
    "verified_at": "2026-07-27",
    "confidence": 0.9,
    "notes": "Requirement text verbatim from the adventure's official page."
  },
  "notes": null
}
