{
  "$schema": "https://sethmay.github.io/open-scout-api/schema/v1/requirement-set.schema.json",
  "id": "adventure-earth-rocks-2018",
  "kind": "requirement-set",
  "subject": "adventure:earth-rocks",
  "effective_from": "2018-09-01",
  "effective_to": "2022-06-01",
  "supersedes": null,
  "source_document": {
    "title": "Earth Rocks! — Cub Scout Adventure requirements (pre-2024 program, USSSP archive)",
    "url": "http://usscouts.org/advance/cubscout/old/webelos-aol-elective-2018.asp",
    "year": 2018
  },
  "includes_official_text": true,
  "text_rights": "Requirement text © Scouting America, reproduced with attribution for non-commercial Scouting use; NOT licensed under this dataset's CC BY-NC-SA. See NOTICE.md.",
  "completion_rule": null,
  "requirements": [
    {
      "number": "1",
      "text": "Do the following:",
      "children": [
        {
          "number": "1a",
          "text": "Explain the meaning of the word “geology.”"
        },
        {
          "number": "1b",
          "text": "Explain why this kind of science is an important part of your world."
        }
      ]
    },
    {
      "number": "2",
      "text": "Look for different kinds of rocks or minerals while on a rock hunt with your family or your den."
    },
    {
      "number": "3",
      "text": "Do the following:",
      "children": [
        {
          "number": "3a",
          "text": "Identify the rocks you see on your rock hunt. Use the information in your handbook to determine which types of rocks you have collected."
        },
        {
          "number": "3b",
          "text": "With a magnifying glass, take a closer look at your collection. Determine any differences between your specimens."
        },
        {
          "number": "3c",
          "text": "Share what you see with your family or den."
        }
      ]
    },
    {
      "number": "4",
      "text": "Do the following:",
      "children": [
        {
          "number": "4a",
          "text": "With your family or den, make a mineral test kit, and test minerals according to the Mohs scale of mineral hardness."
        },
        {
          "number": "4b",
          "text": "Record the results in your handbook."
        }
      ]
    },
    {
      "number": "5",
      "text": "Identify on a map of your state some geological features in your area."
    },
    {
      "number": "6",
      "text": "Do the following:",
      "children": [
        {
          "number": "6a",
          "text": "Identify some of the geological building materials used in building your home."
        },
        {
          "number": "6b",
          "text": "Identify some of the geological materials used around your community"
        }
      ]
    }
  ],
  "provenance": {
    "sources": [
      {
        "url": "http://usscouts.org/advance/cubscout/old/webelos-aol-elective-2018.asp",
        "accessed": "2026-07-27"
      }
    ],
    "method": "scraped",
    "verified_at": "2026-07-27",
    "confidence": 0.8,
    "notes": "Requirement text verbatim from the USSSP archive of the pre-2024 program."
  },
  "notes": null
}
